{
  "schema_version": 1,
  "atlas_id": "frontend-behavior-atlas",
  "generated_at": "2026-08-28T00:00:00+09:00",
  "status": "incomplete-human-review-required",
  "input_digest": "sha256:ab0328cf50abba845c9301384d3aadcc8eaf305e891ce53c338ad88e29799e9c",
  "body_storage": "digest-and-locator-context-digest-only",
  "summary": {
    "locked_sources": 84,
    "fetched_digest_matched": 81,
    "fetched_digest_stale": 3,
    "fetch_failed": 0,
    "candidate_surfaces": 235,
    "root_locators": 202,
    "fragments_found": 29,
    "fragments_not_found": 0,
    "locator_evaluations_deferred": 4,
    "reference_edges_classified": 235,
    "unclassified_reference_edges": 0,
    "authority_text_surfaces_exhaustive": false,
    "human_reviewed_surfaces": 0,
    "core_v2_eligible_surfaces": 0
  },
  "sources": [
    {
      "id": "dom-spec-whatwg-org-6dd6dd83de",
      "path": "authority/surfaces-draft/dom-spec-whatwg-org-6dd6dd83de.json",
      "digest": "sha256:f282a36c66997a38f255f70d9e6b54cfc5974a615f35969775cdc7a992166045",
      "locked_digest_match": true,
      "candidate_surfaces": 2,
      "locator_status": {
        "fragment-found": 2
      }
    },
    {
      "id": "drafts-csswg-org-3f53deee02",
      "path": "authority/surfaces-draft/drafts-csswg-org-3f53deee02.json",
      "digest": "sha256:ddb5edd4b6ac39e002d3ffe9fd114fab6b65ae485e2cc23ab933db90155a3768",
      "locked_digest_match": true,
      "candidate_surfaces": 1,
      "locator_status": {
        "fragment-found": 1
      }
    },
    {
      "id": "drafts-csswg-org-99441ec3a7",
      "path": "authority/surfaces-draft/drafts-csswg-org-99441ec3a7.json",
      "digest": "sha256:380760728a10e1dce0986fd721d99f40c26f8d7085c89b28faad2bb50e657349",
      "locked_digest_match": true,
      "candidate_surfaces": 1,
      "locator_status": {
        "fragment-found": 1
      }
    },
    {
      "id": "drafts-csswg-org-d42e1ba5d9",
      "path": "authority/surfaces-draft/drafts-csswg-org-d42e1ba5d9.json",
      "digest": "sha256:ab597d6e5af131fb3aff0984ee91149417367117193cdae1dfc03e22cf6da806",
      "locked_digest_match": true,
      "candidate_surfaces": 1,
      "locator_status": {
        "root-document": 1
      }
    },
    {
      "id": "github-com-7bbe62dd53",
      "path": "authority/surfaces-draft/github-com-7bbe62dd53.json",
      "digest": "sha256:3aa24c19f75b28d23d24f8c5f31b14a8c30e631e96063e54a180956a9b1e36f8",
      "locked_digest_match": false,
      "candidate_surfaces": 1,
      "locator_status": {
        "not-evaluated-stale-body": 1
      }
    },
    {
      "id": "html-spec-whatwg-org-05532ad608",
      "path": "authority/surfaces-draft/html-spec-whatwg-org-05532ad608.json",
      "digest": "sha256:daa86f798b24e1c7031def364e16624cf9ba6a0090cefd065444a7dfc73f42c8",
      "locked_digest_match": true,
      "candidate_surfaces": 1,
      "locator_status": {
        "fragment-found": 1
      }
    },
    {
      "id": "html-spec-whatwg-org-0bfc98d502",
      "path": "authority/surfaces-draft/html-spec-whatwg-org-0bfc98d502.json",
      "digest": "sha256:3e956047771c09a4c91deb1c7e5f0cb86fc4bb72ff992e165d4e4fe00d12911a",
      "locked_digest_match": true,
      "candidate_surfaces": 2,
      "locator_status": {
        "fragment-found": 2
      }
    },
    {
      "id": "html-spec-whatwg-org-1955a66515",
      "path": "authority/surfaces-draft/html-spec-whatwg-org-1955a66515.json",
      "digest": "sha256:f47723de6ceddb4a50e51220ce46edffb33b06f2b6c5c793d27ce30504101db7",
      "locked_digest_match": true,
      "candidate_surfaces": 1,
      "locator_status": {
        "fragment-found": 1
      }
    },
    {
      "id": "html-spec-whatwg-org-1cd861b96c",
      "path": "authority/surfaces-draft/html-spec-whatwg-org-1cd861b96c.json",
      "digest": "sha256:a385e9e4d8c9028470e41ade9b3f0556c46c7df793ad495d9f35e5d43c1a4196",
      "locked_digest_match": true,
      "candidate_surfaces": 6,
      "locator_status": {
        "fragment-found": 6
      }
    },
    {
      "id": "html-spec-whatwg-org-2c571910c7",
      "path": "authority/surfaces-draft/html-spec-whatwg-org-2c571910c7.json",
      "digest": "sha256:602a29e1ca765ce48c068fe78bd865ea2b2983da2b2994a948cff9e01b775bc9",
      "locked_digest_match": true,
      "candidate_surfaces": 31,
      "locator_status": {
        "root-document": 31
      }
    },
    {
      "id": "html-spec-whatwg-org-41179b4efa",
      "path": "authority/surfaces-draft/html-spec-whatwg-org-41179b4efa.json",
      "digest": "sha256:124c2389509f0d26c654e0131da76f6b83e5e0922bcfdc3b869eb48d522d3a0d",
      "locked_digest_match": true,
      "candidate_surfaces": 2,
      "locator_status": {
        "root-document": 2
      }
    },
    {
      "id": "html-spec-whatwg-org-5533d26f45",
      "path": "authority/surfaces-draft/html-spec-whatwg-org-5533d26f45.json",
      "digest": "sha256:acda9b725f8cbf7b1ae4a40241c3a80d7e9dd105d63f3585602ba5a6a513e9f7",
      "locked_digest_match": true,
      "candidate_surfaces": 1,
      "locator_status": {
        "root-document": 1
      }
    },
    {
      "id": "html-spec-whatwg-org-6dc59a763d",
      "path": "authority/surfaces-draft/html-spec-whatwg-org-6dc59a763d.json",
      "digest": "sha256:3cc188d2ca4ac03b024b9eeb7aa7157e86709862700ac54e1a2e0b39e1f82645",
      "locked_digest_match": true,
      "candidate_surfaces": 1,
      "locator_status": {
        "fragment-found": 1
      }
    },
    {
      "id": "html-spec-whatwg-org-7c1e512c2d",
      "path": "authority/surfaces-draft/html-spec-whatwg-org-7c1e512c2d.json",
      "digest": "sha256:f26328b731bc0b7a4cfb5ab5dba270c35cd262a03eaf6376dfd56caaf84bd73e",
      "locked_digest_match": true,
      "candidate_surfaces": 1,
      "locator_status": {
        "root-document": 1
      }
    },
    {
      "id": "html-spec-whatwg-org-8ece377b96",
      "path": "authority/surfaces-draft/html-spec-whatwg-org-8ece377b96.json",
      "digest": "sha256:054e0fde012b218ed6b44a277b05cd6f9141ae19b559c8672f65d33a15925820",
      "locked_digest_match": true,
      "candidate_surfaces": 14,
      "locator_status": {
        "root-document": 14
      }
    },
    {
      "id": "html-spec-whatwg-org-b77d59af7b",
      "path": "authority/surfaces-draft/html-spec-whatwg-org-b77d59af7b.json",
      "digest": "sha256:3ad64c84e7f4760fb9e0420f39e4170cff012ebb7a048b35838eb9cf44ca95c6",
      "locked_digest_match": true,
      "candidate_surfaces": 1,
      "locator_status": {
        "root-document": 1
      }
    },
    {
      "id": "html-spec-whatwg-org-c3c0c235d3",
      "path": "authority/surfaces-draft/html-spec-whatwg-org-c3c0c235d3.json",
      "digest": "sha256:e3426c7e6f0d93fa60f8a0e9544f81fc70ab53a99966aa5c63419cc420b82476",
      "locked_digest_match": true,
      "candidate_surfaces": 1,
      "locator_status": {
        "root-document": 1
      }
    },
    {
      "id": "html-spec-whatwg-org-de123d69b6",
      "path": "authority/surfaces-draft/html-spec-whatwg-org-de123d69b6.json",
      "digest": "sha256:5303195106aecd803a71b453858d953e8080187d4cbf663e3eca92371777158f",
      "locked_digest_match": true,
      "candidate_surfaces": 1,
      "locator_status": {
        "root-document": 1
      }
    },
    {
      "id": "html-spec-whatwg-org-ea82f49406",
      "path": "authority/surfaces-draft/html-spec-whatwg-org-ea82f49406.json",
      "digest": "sha256:6fdf9534b24fd7726bbba6416b845ba6ccdb1cb33130dbe9f3bb0b00c2c166ea",
      "locked_digest_match": true,
      "candidate_surfaces": 1,
      "locator_status": {
        "root-document": 1
      }
    },
    {
      "id": "html-spec-whatwg-org-ef03980f44",
      "path": "authority/surfaces-draft/html-spec-whatwg-org-ef03980f44.json",
      "digest": "sha256:66cee861239e78cff583ade158500ddb65da029ab2fd75837e9dac2b191baf87",
      "locked_digest_match": true,
      "candidate_surfaces": 1,
      "locator_status": {
        "fragment-found": 1
      }
    },
    {
      "id": "registry-khronos-org-9e94787993",
      "path": "authority/surfaces-draft/registry-khronos-org-9e94787993.json",
      "digest": "sha256:68ba731cff32953dd4d050bead230317d3d946e02e943ebcedeb89b93f7dbd8b",
      "locked_digest_match": false,
      "candidate_surfaces": 1,
      "locator_status": {
        "not-evaluated-stale-body": 1
      }
    },
    {
      "id": "registry-khronos-org-babcf01a32",
      "path": "authority/surfaces-draft/registry-khronos-org-babcf01a32.json",
      "digest": "sha256:a59e58160d946e8ddccf241f9a17e364403ea54e1bf3e316f549604c07b861a9",
      "locked_digest_match": false,
      "candidate_surfaces": 2,
      "locator_status": {
        "not-evaluated-stale-body": 2
      }
    },
    {
      "id": "rive-app-a9c71c4d77",
      "path": "authority/surfaces-draft/rive-app-a9c71c4d77.json",
      "digest": "sha256:401a0719b1f3be97e548e198cbf70ed365625eec3996d3ec3bab4bcce3675830",
      "locked_digest_match": true,
      "candidate_surfaces": 1,
      "locator_status": {
        "root-document": 1
      }
    },
    {
      "id": "tc39-es-132970061b",
      "path": "authority/surfaces-draft/tc39-es-132970061b.json",
      "digest": "sha256:9e32dd8029a8fde931112f509c53873f57caa25f5f24d6050edf93d5d572edbd",
      "locked_digest_match": true,
      "candidate_surfaces": 1,
      "locator_status": {
        "fragment-found": 1
      }
    },
    {
      "id": "tc39-es-637a146a89",
      "path": "authority/surfaces-draft/tc39-es-637a146a89.json",
      "digest": "sha256:c64c8d38fc2ca7f284195c922e80ad714d9c19c1b9764c0596f4afa985a597f6",
      "locked_digest_match": true,
      "candidate_surfaces": 1,
      "locator_status": {
        "root-document": 1
      }
    },
    {
      "id": "w3-org-0170adad47",
      "path": "authority/surfaces-draft/w3-org-0170adad47.json",
      "digest": "sha256:efeccc9b8ef90c02128d5e631b4d3aa1207c3118c0b5a00ba9b0e405d0d9c854",
      "locked_digest_match": true,
      "candidate_surfaces": 1,
      "locator_status": {
        "fragment-found": 1
      }
    },